incident_id,malware_family,category,first_seen,last_seen,exploited_cves,mitre_attack_ids,tactics_techniques,technical_traits,propagation_vectors,persistence_mechanisms,victim_industries,victim_count,geographic_impact,impact_metrics,ransom_amount_usd,ransom_currency,payment_made,c2_infrastructure,detection_sources,mitigation,references,credibility_score,notes
MAL-2016-02-16,Locky,Ransomware,2016-02-16,Ongoing,N/A,T1059.003; T1106; T1486; T1071.001,Windows Command Shell; Native API; Data Encrypted for Impact; Application Layer Protocol: Web Protocols,"{""encryption"":""RSA-2048; AES-128"",""language"":""C++"",""payload"":""Windows PE (DLL)""}",Phishing (malicious macro); Phishing (JS attachment),Registry Run Keys (Software\Microsoft\Windows\CurrentVersion\Run),Healthcare; All Sectors,N/A,US; DE; FR; UK,"{""notes"":""Extremely high volume spam campaigns observed.""}",300.0,BTC,N/A,DGA; Hard-coded IPs,Avast; KnowBe4; Palo Alto Networks,"Block malicious email attachments (.js, .docm); Disable macros; User training.",https://blog.avast.com/a-closer-look-at-the-locky-ransomware;https://www.knowbe4.com/ransomware-knowledgebase/locky,0.8,"Initially spread via Word docs with malicious macros, later shifted to .js attachments. Associated with the Dridex botnet operators."
MAL-2016-01-01,SamSam,Ransomware,2016-01-01,Ongoing,CVE-2010-0738; CVE-2015-7501,T1190; T1021.002; T1059.003; T1486,Exploit Public-Facing Application; SMB/Windows Admin Shares; Windows Command Shell; Data Encrypted for Impact,"{""encryption"":""RSA-2048"",""payload"":""Windows PE""}",RDP brute-force; Exploitation (JBoss servers),"N/A (often human-operated, not automated)",Healthcare; Government; Education,230,US; UK,"{""estimated_cost_usd"":30000000,""notes"":""Figure is cumulative impact on victims like City of Atlanta (2018).""}",12000.0,BTC,N/A,N/A,CISA; Sophos; Matisoft Labs,"Patch public-facing servers (JBoss, RDP); Strong RDP passwords; Network segmentation.",https://www.cisa.gov/news-events/alerts/2018/11/28/samsam-ransomware;https://www.matisoftlabs.com/case-studies/samsam,0.9,"Highly targeted (not spam-based). Operators would gain access, perform reconnaissance, and then manually deploy the ransomware to critical systems."
MAL-2016-03-22,Petya,Ransomware,2016-03-22,Ongoing,N/A,T1059.003; T1486; T1542.003,Windows Command Shell; Data Encrypted for Impact; Master Boot Record,"{""encryption"":""Salsa20 (MFT); RSA-4096 (key)""}",Phishing (malicious macro),Master Boot Record (MBR) overwrite,Human Resources; All Sectors,N/A,DE; Global,"{""notes"":""Encrypts the Master File Table (MFT) of the NTFS file system, making the entire disk inaccessible.""}",430.0,BTC,N/A,N/A,Check Point; Kaspersky,Block malicious attachments; User training; MBR protection.,https://research.checkpoint.com/2016/petya-ransomware/,0.7,"Unlike file-encrypting ransomware, Petya (and its later variant NotPetya) encrypts the file system structure itself."
MAL-2016-02-01,Cerber,Ransomware,2016-02-01,Ongoing,N/A,T1059.007; T1486; T1071.001,JavaScript/JScript; Data Encrypted for Impact; Application Layer Protocol: Web Protocols,"{""encryption"":""RSA; RC4"",""payload"":""Windows PE""}",Phishing (malicious attachments); Exploit Kits (Rig EK),Registry Run Keys,All Sectors,N/A,Global,"{""notes"":""Operated as a Ransomware-as-a-Service (RaaS). Used a text-to-speech component to read the ransom note aloud.""}",500.0,BTC,N/A,DGA,Check Point; Malwarebytes,Block malicious attachments; Keep browsers and plugins (Flash) patched; Ad blockers.,https://www.malwarebytes.com/blog/threat-intelligence/2016/03/cerber-ransomware-a-frightening-new-development,0.8,One of the most dominant RaaS platforms of 2016-2017.
MAL-2016-05-31,TeslaCrypt,Ransomware,2014-02-01,2016-05-31,N/A,T1190; T1486,Exploit Public-Facing Application; Data Encrypted for Impact,"{""encryption"":""AES""}","Exploit Kits (Angler, Magnitude)",N/A,Gaming; All Sectors,N/A,Global,"{""notes"":""Targeted files related to video games. Master key was released by authors in May 2016.""}",500.0,BTC,N/A,N/A,ESET; BleepingComputer,Keep browsers and plugins (Flash) patched.,https://www.welivesecurity.com/2016/05/18/teslacrypt-shuts-down-master-key-released/,0.9,"Notable for its shutdown in May 2016, when the operators released the master decryption key for free."
MAL-2017-05-12,WannaCry,Ransomware,2017-05-12,2017-05-15,CVE-2017-0144; CVE-2017-0145,T1190; T1021.002; T1210; T1486; T1071.001,Exploit Public-Facing Application; SMB/Windows Admin Shares; Exploitation of RemoteServices; Data Encrypted for Impact; Application Layer Protocol: Web Protocols,"{""encryption"":""AES-128; RSA-2048"",""propagation"":""SMBv1 worm (EternalBlue)""}",Exploitation (EternalBlue),"N/A (relied on worm for spread, not strong persistence)",Healthcare; Government; Manufacturing,300000,Global (150+ countries),"{""estimated_cost_usd"":4000000000,""infections"":300000}",300.0,BTC,FALSE,Hard-coded killswitch domain; Hard-coded C2 IPs,CISA; AUSCERT; Malwarebytes,Apply MS17-010 patch; Disable SMBv1; Block SMBv1 (port 445) at network boundary.,https://www.cisa.gov/sites/default/files/FactSheets/NCCIC%20ICS_FactSheet_WannaCry_Ransomware_S508C.pdf;https://www.auscert.org.au/publications/major-security-incidents/2017-05-13-wannacry-ransomware-incident/,1.0,Global wormable ransomware outbreak. Spread rapidly by exploiting the 'EternalBlue' SMBv1 vulnerability. Halted by a security researcher activating a 'killswitch' domain.
MAL-2017-01-01,Cerber,Ransomware,2016-02-01,Ongoing,N/A,T1190; T1566.001; T1486,Exploit Public-Facing Application; Phishing: Spearphishing Attachment; Data Encrypted for Impact,"{""encryption"":""RSA; RC4"",""raas"":true}",Phishing (malicious attachments); Exploit Kits (Rig EK),Registry Run Keys,All Sectors,N/A,Global,"{""notes"":""Continued to be a dominant RaaS platform throughout 2017.""}",500.0,BTC,N/A,DGA,Malwarebytes,Keep browsers and plugins (Flash) patched; Email filtering.,https://www.malwarebytes.com/blog/threat-intelligence/2017/02/cerber-ransomware-in-2017,0.7,"Remained a major threat in 2017, spread via multiple exploit kits and spam campaigns."
MAL-2017-09-01,Locky,Ransomware,2016-02-16,Ongoing,N/A,T1566.001; T1059.003; T1486,Phishing: Spearphishing Attachment; Windows Command Shell; Data Encrypted for Impact,"{""encryption"":""RSA-2048; AES-128"",""variant"":""Lukitus; Ykcol""}",Phishing (Necurs botnet),Registry Run Keys,All Sectors,N/A,Global,"{""notes"":""Resurgence in late 2017 with new variants like 'Lukitus' and 'Ykcol' spread by Necurs.""}",500.0,BTC,N/A,DGA; Hard-coded IPs,Symantec; KnowBe4,Email security gateways; Spam filtering; Disable macros.,https://www.knowbe4.com/ransomware-knowledgebase/locky,0.8,"After a quiet period, Locky returned with massive spam campaigns in Aug/Sep 2017."
MAL-2017-01-26,Spora,Ransomware,2017-01-26,Ongoing,N/A,T1083; T1486,File and Directory Discovery; Data Encrypted for Impact,"{""encryption"":""RSA; AES; RC4"",""features"":""Offline encryption (uses embedded public key)""}",Phishing (malicious .HTA attachments),N/A,N/A,N/A,RU,"{""notes"":""Sophisticated ransomware with a professional-looking payment portal. Capable of offline encryption.""}",79.0,BTC,N/A,N/A,Kaspersky,Block malicious .HTA files; User training.,https://securelist.com/spora-ransomware/77080/,0.7,Notable for its high-quality code and ability to encrypt files without an internet connection.
MAL-2017-10-24,Bad Rabbit,Ransomware,2017-10-24,2017-10-25,N/A,T1566.002; T1210; T1003.001; T1486,Phishing: Spearphishing Link; Exploitation of RemoteServices; OS Credential Dumping; Data Encrypted for Impact,"{""encryption"":""AES-128; RSA-2048"",""propagation"":""Mimikatz (credential harvesting); SMB (EternalRomance-like)""}","Drive-by download (fake Flash update); Lateral movement (Mimikatz, hardcoded creds, SMB)",N/A,Media; Transportation,N/A,RU; UA; TR; DE,"{""notes"":""Contained many components from NotPetya, suggesting a shared developer. Spread via compromised media websites.""}",280.0,BTC,FALSE,N/A,ESET; Kaspersky,User training (fake updates); Patch SMB vulnerabilities; Restrict admin credentials.,https://www.welivesecurity.com/2017/10/24/bad-rabbit-not-petya-ransomware/,0.8,"A targeted attack primarily hitting Russia and Ukraine, spreading through drive-by downloads on compromised news sites."
MAL-2017-02-14,Jaff,Ransomware,2017-02-14,2017-06-01,N/A,T1566.001; T1059.005; T1486,Phishing: Spearphishing Attachment; Visual Basic; Data Encrypted for Impact,"{""encryption"":""AES""}",Phishing (Necurs botnet),Registry Run Keys,All Sectors,N/A,Global,"{""notes"":""Distributed heavily by the Necurs botnet in large spam campaigns.""}",1800.0,BTC,N/A,N/A,Heimdal Security,Email security gateways; Spam filtering.,https://heimdalsecurity.com/blog/security-alert-jaff-ransomware-necurs-botnet/,0.7,"Another major payload of the Necurs botnet, though it was less successful and shorter-lived than Locky."
MAL-2018-01-28,GandCrab,Ransomware,2018-01-28,2019-05-31,CVE-2017-8570; CVE-2017-11882; CVE-2018-0802,T1190; T1566.001; T1210; T1486,Exploit Public-Facing Application; Phishing: Spearphishing Attachment; Exploitation of RemoteServices; Data Encrypted for Impact,"{""encryption"":""RSA-2048; Salsa20"",""raas"":true,""payment_currency"":""DASH""}","Phishing (malicious attachments); Exploit Kits (Rig, GrandSoft); RDP brute-force",Registry Run Keys,All Sectors,N/A,Global,"{""notes"":""One of the most prolific RaaS families of 2018-2019. First major ransomware to demand DASH cryptocurrency.""}",600.0,DASH,N/A,.bit TLD domains (Tor2web),Trend Micro; KnowBe4; CrowdStrike,Patch Office vulnerabilities; Secure RDP; Email filtering.,https://www.knowbe4.com/ransomware-knowledgebase/gandcrab;https://success.trendmicro.com/en-US/solution/ka-0009124,0.8,"Operated a successful RaaS affiliate program. The developers 'retired' in 2019, claiming to have made over $2B."
MAL-2018-01-01,SamSam,Ransomware,2016-01-01,Ongoing,CVE-2010-0738; CVE-2017-5638,T1190; T1078; T1021.001; T1059.003; T1486,Exploit Public-Facing Application; Valid Accounts; RDP; Windows Command Shell; Data Encrypted for Impact,"{""encryption"":""RSA-2048"",""target"":""Targeted (human-operated)""}","RDP brute-force; Exploitation (JBoss, Apache Struts)",N/A (manual deployment),Healthcare; Government; Education,230,US,"{""estimated_cost_usd"":8500000,""notes"":""Cost for City of Atlanta. Total ransom paid by victims estimated at $6M+""}",50000.0,BTC,N/A,N/A,CISA; Sophos; Matisoft Labs,"Patch public-facing servers (JBoss, RDP, Struts); Secure RDP; Network segmentation.",https://www.cisa.gov/news-events/alerts/2018/11/28/samsam-ransomware;https://www.justice.gov/opa/pr/two-iranian-men-indicted-deploying-samsam-ransomware-extort-hospitals-municipalities-and,0.9,"Continued its targeted attacks, famously hitting the City of Atlanta in March 2018, causing massive disruption."
MAL-2018-08-01,Ryuk,Ransomware,2018-08-01,Ongoing,N/A,T1003.001; T1057; T1070.004; T1021.001; T1486,OS Credential Dumping; Process Discovery; File Deletion; RDP; Data Encrypted for Impact,"{""encryption"":""RSA-4096; AES-256"",""target"":""Targeted (human-operated)""}",Dropped by TrickBot (which was dropped by Emotet); RDP,Scheduled Task,Enterprise; Government; Healthcare,N/A,Global,"{""notes"":""'Big game hunting' ransomware. Highly targeted, high-demand ransoms. Part of Emotet->TrickBot->Ryuk chain.""}",100000.0,BTC,N/A,N/A,CISA; CrowdStrike,Block Emotet/TrickBot; Secure RDP; Network segmentation; Offline backups.,https://www.cisa.gov/news-events/alerts/2021/02/10/alert-ryuk-ransomware,0.9,"Emerged in 2018 as a major 'big game hunting' ransomware, deployed manually after network reconnaissance by TrickBot operators."
MAL-2018-03-01,Dharma (Crisis),Ransomware,2016-01-01,Ongoing,N/A,T1078; T1021.001; T1486,Valid Accounts; RDP; Data Encrypted for Impact,"{""encryption"":""AES-256"",""raas"":true}",RDP brute-force; Compromised credentials,N/A,All Sectors (Small/Medium Business),N/A,Global,"{""notes"":""Often spread via exposed RDP ports. Source code was allegedly leaked, leading to many variants.""}",1500.0,BTC,N/A,N/A,CISA; Sophos,Secure RDP; Strong passwords; MFA.,https://www.cisa.gov/news-events/alerts/2020/03/04/alert-dharma-ransomware,0.8,"Became very prominent in 2018, primarily targeting organizations with weak or exposed RDP."
MAL-2018-09-19,Sodinokibi (REvil),Ransomware,2018-09-19,2021-07-13,CVE-2018-8453; CVE-2019-2725,T1190; T1068; T1057; T1486,Exploit Public-Facing Application; Exploitation for Privilege Escalation; Process Discovery; Data Encrypted for Impact,"{""encryption"":""Salsa20; Curve25519"",""raas"":true}",Exploitation (Oracle WebLogic); RDP; Dropped by other malware,N/A,All Sectors,N/A,Global,"{""notes"":""Believed to be the successor to GandCrab, operated by the same group. Also a RaaS platform.""}",2500.0,XMR,N/A,DGA,Secureworks; McAfee,Patch WebLogic; Secure RDP; Privilege separation.,https://www.secureworks.com/research/sodinokibi-ransomware,0.8,"Although it became most famous in 2019-2021, its origins trace to late 2018 as the GandCrab RaaS was winding down."
MAL-2019-05-01,Maze,Ransomware,2019-05-01,2020-11-30,"[""CVE-2019-19781"", ""CVE-2019-11510""]","[""T1193"",""T1566.001"",""T1499""]","[""Phishing emails"",""Exploiting Citrix ADC and Pulse Secure VPN""]","{""encryption"":""RSA + ChaCha20"",""double_extortion"":true}","[""Phishing"",""Exploit kit""]","[""Scheduled tasks"",""Service installation""]","[""Manufacturing"",""Government"",""Healthcare""]",,"[""US"",""DE"",""CA"",""GB""]","{""estimated_cost_usd"":10000000}",,,,"[""Multiple domains"",""Tor""]","[""SentinelOne""]","Apply patches for known vulnerabilities (Citrix CVE-2019-19781 and Pulse Secure CVE-2019-11510), enforce MFA, implement network segmentation.","[""https://www.sentinelone.com/anthology/maze/#:~:text=Maze%20ransomware%20first%20appeared%20in,similar%20tactics%20against%20their%20victims""]",0.8,Maze introduced double extortion in late 2019; first appeared May 2019 and exploited Citrix and Pulse Secure vulnerabilities.
MAL-2019-04-17,REvil (Sodinokibi),Ransomware,2019-04-17,2021-10-21,"[""CVE-2019-2725""]","[""T1190"",""T1059"",""T1078""]","[""Exploit Oracle WebLogic server"",""PowerShell commands"",""Lateral movement""]","{""encryption"":""ChaCha20 + RSA-2048"",""RaaS"":true}","[""Exploit CVE-2019-2725"",""Phishing"",""Exploit kits""]","[""Registry run keys""]","[""SMBs"",""Managed service providers""]",,"[""US"",""EU"",""Asia""]","{""infections"":200}",,,,"[""Fast flux domains""]","[""Cisco Talos"",""Cybereason""]",Patch Oracle WebLogic; restrict internet-exposed services; implement email filtering and network segmentation.,"[""https://blog.talosintelligence.com/sodinokibi-ransomware-exploits-weblogic/#:~:text=Attackers%20are%20actively%20exploiting%20a,investigating%20these%20attacks%20and%20Sodinokibi"",""https://www.cybereason.com/blog/research/the-sodinokibi-ransomware-attack#:~:text=In%20April%20of%202019%2C%20the,by%20antivirus%20and%20other%20means""]",0.8,Sodinokibi/REvil first exploited Oracle WebLogic vulnerability CVE-2019-2725 in April 2019; later adopted RaaS model and double extortion.
MAL-2019-01-24,LockerGoga,Ransomware,2019-01-24,2019-12-31,[],"[""T1078"",""T1059.003""]","[""Manual lateral movement"",""Metasploit"",""Cobalt Strike""]","{""encryption"":""RSA + AES"",""no C2"":true}","[""Compromised credentials"",""RDP""]","[""Startup folder"",""Services""]","[""Manufacturing"",""Industrial""]",,"[""NO"",""FR"",""US""]","{""downtime_hours"":720}",,,,[],"[""Unit42"",""CIS""]",Monitor for Cobalt Strike/Metasploit activity; restrict admin privileges; implement 2FA.,"[""https://www.cisecurity.org/insights/white-papers/security-primer-lockergoga#:~:text=effects%20on%20industrial%20and%20manufacturing,reside%20in%20the%20industrial%2Fmanufacturing%20sector"",""https://unit42.paloaltonetworks.com/born-this-way-origins-of-lockergoga/#:~:text=The%20LockerGoga%20ransomware%20was%20first,code%20path%20discovered%20by%20MalwareHunterTeam""]",0.8,LockerGoga was first publicly reported in January 2019 after an attack on Altran and later impacted Norsk Hydro and other industrial companies.
MAL-2019-01-01,Ryuk,Ransomware,2018-08-01,2021-12-31,[],"[""T1105"",""T1486""]","[""Delivered via TrickBot and Emotet"",""High‑value targeting""]","{""encryption"":""RSA‑2048 + AES‑256"",""double_extortion"":false}","[""Phishing campaigns"",""TrickBot infection""]","[""Scheduled tasks"",""Services""]","[""Healthcare"",""Government"",""Education""]",,"[""US"",""CA"",""UK""]","{""average_ransom_usd"":500000}",,,,"[""Multiple IPs""]","[""Webroot""]",Block phishing emails; update antivirus; monitor network for TrickBot/Emotet activity.,"[""https://www.webroot.com/nz/en/about/press-room/releases/2019s-nastiest-threats#:~:text=1.%20Emotet%20,stage%20payload%20off%20of%20Emotet"",""https://www.webroot.com/nz/en/about/press-room/releases/2019s-nastiest-threats#:~:text=1,infection%20chain%20with%20Bitpaymer%20ransomware""]",0.7,Ryuk worked in tandem with TrickBot and Emotet as part of the 2019 triple threat; widely targeted high‑value organisations.
MAL-2019-01-01e,Clop,Ransomware,2019-02-01,2023-06-01,[],"[""T1486"",""T1490""]","[""Encrypting network shares"",""Double extortion""]","{""encryption"":""AES-128 + RSA"",""linked_group"":""TA505""}","[""Phishing"",""Drive-by downloads""]","[""Services"",""Scheduled tasks""]","[""Finance"",""Healthcare""]",,"[""Global""]","{""ransom_demands_usd"":20000000}",,,,"[""Proxy-based""]","[""Canadian Cyber Centre""]",Block phishing attachments; patch systems; implement data backups.,"[""https://www.cyber.gc.ca/en/guidance/profile-ta505-cl0p-ransomware#:~:text=CL0P%20ransomware%20,Footnote%201""]",0.7,Clop ransomware first observed in 2019 and is associated with the TA505 cybercrime group. Known for data leak extortion.
MAL-2019-01-01f,Phobos,Ransomware,2019-01-01,2022-12-31,[],"[""T1490""]","[""Encrypt files"",""RaaS model"",""Variant of Dharma""]","{""encryption"":""AES + RSA"",""variant"":""Crysis/Dharma""}","[""RDP brute force"",""Phishing""]","[""Services""]","[""SMBs""]",,"[""Global""]","{""ransom_range_usd"":""<5000""}",,,,[],"[""Infosecurity Magazine"",""Avertium""]",Secure RDP endpoints; apply multi-factor authentication; maintain backups.,"[""https://www.infosecurity-magazine.com/news/phobos-ransomware-new-faust-variant/#:~:text=Phobos%2C%20which%20first%20emerged%20in,cryptocurrency%20for%20the%20decryption%20key"",""https://www.avertium.com/resources/threat-reports/phobos-ransomware#:~:text=,on%20a%20wide%20range%20of""]",0.7,"Phobos ransomware, first identified in 2019, is a variant of the Crysis/Dharma family and spreads via RDP compromise and phishing."
MAL-2019-10-15,Snatch,Ransomware,2018-12-01,2020-12-31,[],"[""T1490"",""T1562.004""]","[""Reboots Windows into Safe Mode"",""Brute force RDP/VNC""]","{""encryption"":""AES + RSA"",""safe_mode"":true}","[""RDP brute force""]","[""Service installation""]","[""Various""]",,"[""Global""]",{},,,,[],"[""Sophos""]",Disable unused remote services; implement strong passwords and lockout policies.,"[""https://news.sophos.com/en-us/2019/12/09/snatch-ransomware-reboots-pcs-into-safe-mode-to-bypass-protection/#:~:text=In%20mid,encrypts%20the%20victims%E2%80%99%20hard%20drives""]",0.8,Snatch ransomware observed in 2019 uses a unique technique of rebooting systems into Safe Mode to evade endpoint security.
MAL-2020-08-01,DarkSide,Ransomware,2020-08-01,2021-05-10,[],"[""T1566"",""T1078"",""T1059""]","[""Phishing emails"",""RDP abuse"",""Exploiting known vulnerabilities""]","{""encryption"":""ChaCha20/RSA-4096 (Linux) and Salsa20/RSA-1024 (Windows)"",""RaaS"":true}","[""Phishing"",""Brute-force RDP"",""Exploiting VPN and software flaws""]","[""PowerShell scripts"",""Scheduled tasks""]","[""Energy"",""Manufacturing"",""Law firms""]",,"[""US"",""CA"",""EU""]","{""average_ransom_usd"":1000000}",,,,"[""Tor hidden services""]","[""Trend Micro""]",Implement MFA on remote services; patch internet-facing systems; monitor for PowerShell and Cobalt Strike activity.,"[""https://www.trendmicro.com/en_us/research/21/e/what-we-know-about-darkside-ransomware-and-the-us-pipeline-attac.html#:~:text=Here%20is%20a%20short%20timeline,compiled%20from%20publicly%20available%20reports"",""https://www.trendmicro.com/en_us/research/21/e/what-we-know-about-darkside-ransomware-and-the-us-pipeline-attac.html#:~:text=In%20our%20analysis%20of%20DarkSide,undetected%20and%20obfuscate%20its%20attack"",""https://www.trendmicro.com/en_us/research/21/e/what-we-know-about-darkside-ransomware-and-the-us-pipeline-attac.html#:~:text=,persistence"",""https://www.trendmicro.com/en_us/research/21/e/what-we-know-about-darkside-ransomware-and-the-us-pipeline-attac.html#:~:text=In%20addition%20to%20PowerShell%2C%20which,1024%20is%20used%20on%20Windows""]",0.8,"DarkSide ransomware appeared in August 2020 and later evolved into a RaaS. It used phishing and RDP abuse for initial access and targeted major critical infrastructure, culminating in the Colonial Pipeline attack."
MAL-2019-12-31,Conti,Ransomware,2019-12-31,2022-12-31,[],"[""T1078"",""T1105"",""T1486""]","[""Leveraging TrickBot"",""Lateral movement via SMB"",""Double extortion""]","{""encryption"":""ChaCha (2020 variant)"",""code_base"":""Ryuk lineage""}","[""TrickBot infections"",""Phishing"",""RDP""]","[""Scheduled tasks"",""Services""]","[""Healthcare"",""Education"",""Government""]",,"[""Global""]","{""average_ransom_usd"":800000}",,,,"[""TrickBot infrastructure""]","[""SentinelLabs"",""BleepingComputer""]",Disable SMBv1; patch systems; monitor for TrickBot infections; implement network segmentation.,"[""https://www.sentinelone.com/labs/conti-unpacked-understanding-ransomware-development-as-a-response-to-detection/#:~:text=Conti%20is%20developed%20and%20maintained,on%20the%20same%20TrickBot%20infrastructure"",""https://www.bleepingcomputer.com/news/security/conti-ransomware-shows-signs-of-being-ryuks-successor/#:~:text=The%20Conti%20Ransomware%20is%20an,while%20Conti%27s%20distribution%20is%20increasing""]",0.8,Conti ransomware was first observed at the end of 2019 and became prominent in 2020; it uses TrickBot for initial access and applies double extortion.
MAL-2020-09-01,Egregor,Ransomware,2020-09-01,2021-02-01,[],"[""T1193"",""T1078"",""T1071.001""]","[""Phishing with malicious macros"",""Use of Qbot/IcedID/Ursnif"",""BITSAdmin for payload download""]","{""encryption"":""ChaCha20/EC:Curve25519"",""RaaS"":true}","[""Malspam"",""Compromised accounts""]","[""Scheduled tasks""]","[""Retail"",""Manufacturing"",""Media""]",,"[""Global""]","{""average_ransom_usd"":500000}",,,,"[""Tor""]","[""MITRE ATT&CK"",""Cybereason""]",Educate users on phishing; deploy macro protection; monitor BITS and RClone activities.,"[""https://attack.mitre.org/software/S0554/#:~:text=Egregor%20%20is%20a%20Ransomware,3"",""https://www.cybereason.com/blog/cybereason-vs-egregor-ransomware#:~:text=Egregor%20is%20a%20newly%20identified,industry%20giants%20Crytek%20and%20Ubisoft""]",0.8,Egregor ransomware emerged in September 2020 and used the Qbot/IcedID infection chain; it practiced double extortion and utilised BITSAdmin to download payloads.
MAL-2019-08-01,NetWalker,Ransomware,2019-08-01,2021-01-12,"[""CVE-2019-11510"",""CVE-2020-0688""]","[""T1190"",""T1078"",""T1486""]","[""Exploiting VPN and RDP vulnerabilities"",""COVID‑19 themed phishing"",""Double extortion""]","{""encryption"":""ChaCha20 + RSA-4096"",""RaaS_launch"":""2020-03""}","[""VPN exploits"",""Phishing"",""Brute force""]","[""Scheduled tasks""]","[""Healthcare"",""Education"",""Transportation""]",,"[""Global""]","{""notable_attacks"":2}",,,,"[""Tor hidden services""]","[""Emsisoft""]",Patch VPN and server software; disable exposed RDP; educate employees on phishing.,"[""https://www.emsisoft.com/en/blog/37677/ransomware-profile-netwalker/#:~:text=NetWalker%20is%20a%20type%20of,NetWalker%20team%20and%20their%20affiliates"",""https://www.emsisoft.com/en/blog/37677/ransomware-profile-netwalker/#:~:text=Toward%20the%20end%20of%20March,the%20malicious%20payload%20when%20opened""]",0.8,NetWalker (Mailto) ransomware was first detected in August 2019; it introduced a RaaS program in March 2020 and used vulnerabilities in VPN and web servers to gain access.
MAL-2019-04-01,DoppelPaymer,Ransomware,2019-04-01,2021-03-01,[],"[""T1078"",""T1486"",""T1562.004""]","[""Delivered via Emotet/Dridex"",""Data leak site"",""Process termination using Process Hacker""]","{""encryption"":""RSA-2048 + AES-256"",""based_on"":""BitPaymer""}","[""Phishing"",""Malspam""]","[""Services""]","[""Healthcare"",""Government""]",,"[""Global""]","{""ransom_range_usd"":""25000-1200000""}",,,,"[""Tor""]","[""Trend Micro""]",Train employees on phishing; patch systems; deploy endpoint detection to detect Dridex/Emotet.,"[""https://www.trendmicro.com/en_us/research/21/a/an-overview-of-the-doppelpaymer-ransomware.html#:~:text=In%20early%20December%202020%2C%20the,properly%20carry%20out%20their%20operations"",""https://www.trendmicro.com/en_us/research/21/a/an-overview-of-the-doppelpaymer-ransomware.html#:~:text=Like%20many%20modern%20ransomware%20families%2C,of%20the%20ransomware%E2%80%99s%20extortion%20scheme""]",0.8,DoppelPaymer ransomware emerged in 2019 and was active in 2020; it used Emotet and Dridex for delivery and launched a data leak site to pressure victims.
