incident_id,malware_family,category,first_seen,last_seen,exploited_cves,mitre_attack_ids,tactics_techniques,technical_traits,propagation_vectors,persistence_mechanisms,victim_industries,victim_count,geographic_impact,impact_metrics,ransom_amount_usd,ransom_currency,payment_made,c2_infrastructure,detection_sources,mitigation,references,credibility_score,notes
MAL-2024-02-19,LockBit,Ransomware,2019-09-01,2024-02-19,"[""CVE-2023-4966"", ""CVE-2024-1709""]","[""T1078"", ""T1556"", ""T1486""]","[""Credential Abuse"", ""MFA Bypass"", ""Encryption for Impact""]","{""operation"": ""RaaS"", ""extortion"": ""Triple"", ""modules"": [""Windows"", ""Linux/ESXi""]}","[""Exploiting Citrix Bleed"", ""Exploiting ScreenConnect"", ""Phishing""]","[""Maintaining valid credentials"", ""Backdoors""]","[""Critical Infrastructure"", ""Healthcare"", ""Government"", ""Manufacturing""]",2500.0,"[""US"", ""CA"", ""UK"", ""DE"", ""FR""]","{""victims"": 2500, ""losses_usd"": 1000000000}",,,,"[""Tor"", ""Peer-to-Peer""]","[""Europol"", ""NCA"", ""CISA""]","Implement multi-factor authentication, patch Citrix and ScreenConnect vulnerabilities, monitor for suspicious lateral movement.","[""https://www.europol.europa.eu/media-press/newsroom/news/law-enforcement-disrupt-world\u2019s-biggest-ransomware-operation"", ""https://www.justice.gov/opa/pr/justice-department-announces-arrest-charges-against-lockbit-supp""]",0.9,"Operation Cronos in February 2024 seized LockBit’s infrastructure, compromised 34 servers, arrested two operators, and froze millions in cryptocurrency; LockBit had attacked over 2,500 victims across 120 countrieshttps://www.europol.europa.eu/media-press/newsroom/news/law-enforcement-disrupt-worlds-biggest-ransomware-operation#:~:text=This%20international%20sweep%20follows%20a,level%20by%20Europol%20and%20Eurojusthttps://www.justice.gov/archives/opa/pr/us-charges-russian-national-developing-and-operating-lockbit-ransomware#:~:text=The%20U,ransomware%20group%20in%20the%20world."
MAL-2024-04-18,Akira,Ransomware,2023-03-01,ongoing,"[""CVE-2019-19781"", ""CVE-2023-23397"", ""CVE-2024-1709""]","[""T1078"", ""T1566"", ""T1486""]","[""VPN Exploitation"", ""Phishing"", ""Double Extortion""]","{""variants"": [""Akira"", ""Megazord"", ""Akira_v2""], ""linux_variant"": true, ""extensions"": ["".akira"", "".powerranges""]}","[""Cisco VPN without MFA"", ""RDP"", ""Spear Phishing""]","[""New Domain Accounts"", ""Kerberoasting""]","[""Manufacturing"", ""Finance"", ""Government"", ""Education"", ""Healthcare""]",300.0,"[""US"", ""CA"", ""UK"", ""AU""]","{""victims"": 300, ""ransom_collected_usd"": 42000000}",,,,"[""Tor"", ""Rclone""]","[""CISA"", ""FBI""]","Enforce MFA on VPNs, patch Cisco ASA, disable unused remote services, monitor for Rclone and FileZilla.","[""https://www.cisa.gov/sites/default/files/2024-04/aa24-109a_stopransomware_akira.pdf""]",0.9,"The April 18, 2024 CISA advisory reported that Akira impacted more than 250 organizations globally and introduced Rust-based variants; it uses VPN vulnerabilities and double extortionhttps://www.cisa.gov/news-events/cybersecurity-advisories/aa24-109a#:~:text=The%20United%20States%E2%80%99%20Federal%20Bureau,as%20recently%20as%20February%202024https://www.cisa.gov/news-events/cybersecurity-advisories/aa24-109a#:~:text=The%20FBI%20and%20cybersecurity%20researchers,4%20%28link%20is%20external."
MAL-2024-02-29,Phobos,Ransomware,2019-01-01,ongoing,[],"[""T1566"", ""T1078"", ""T1486""]","[""Phishing"", ""RDP Scanning"", ""Double Extortion""]","{""loader"": ""Smokeloader"", ""dropper"": ""Cobalt Strike""}","[""Phishing Emails"", ""Scanning for Exposed RDP Ports""]","[""Service Creation"", ""Firewall Modification""]","[""Municipal Government"", ""Education"", ""Public Safety"", ""Healthcare""]",,"[""US""]","{""ransoms_requested_usd"": ""Millions""}",,,,"[""Cobalt Strike"", ""Smokeloader""]","[""CISA"", ""FBI""]","Disable or restrict RDP, use strong passwords, update antivirus and EDR tools.","[""https://www.cisa.gov/sites/default/files/2024-02/aa24-060a_stopransomware_phobos.pdf""]",0.9,"The joint advisory on February 29, 2024 highlighted that Phobos ransomware-as-a-service targets municipal governments and public services using phishing and exposed RDP ports, leveraging Smokeloader and Cobalt Strikehttps://www.cisa.gov/news-events/cybersecurity-advisories/aa24-060a#:~:text=Center%20%28MS,74%202%20%28link%20ishttps://www.cisa.gov/news-events/cybersecurity-advisories/aa24-060a#:~:text=MITRE%20ATT%26CK%C2%AE%20tactics%20and%20techniques,link%20is%20external."
MAL-2024-08-29,RansomHub,Ransomware,2024-02-01,ongoing,"[""CVE-2023-3519"", ""CVE-2023-27997"", ""CVE-2023-46604"", ""CVE-2023-22515"", ""CVE-2023-46747"", ""CVE-2023-48788"", ""CVE-2017-0144""]","[""T1566"", ""T1210"", ""T1078""]","[""Phishing"", ""Vulnerability Exploitation"", ""Password Spraying""]","{""rebrand"": ""Formerly Cyclops/Knight"", ""double_extortion"": true}","[""Phishing"", ""Exploiting Citrix, Fortinet, ActiveMQ, Confluence, F5 vulnerabilities""]","[""Abusing legitimate accounts"", ""RATs""]","[""Water"", ""IT"", ""Government"", ""Healthcare"", ""Emergency Services"", ""Agriculture"", ""Finance"", ""Manufacturing"", ""Transportation"", ""Communications""]",210.0,"[""US"", ""CA"", ""EU"", ""BR"", ""AU""]","{""victims"": 210}",,,,"[""Tor"", ""Telegram""]","[""CISA"", ""FBI"", ""MS-ISAC""]","Patch known vulnerabilities, implement MFA, restrict external-facing services, monitor for unusual network traffic.","[""https://www.cisa.gov/sites/default/files/2024-08/aa24-242a_stopransomware_ransomhub.pdf""]",0.9,"RansomHub, rebranded from Cyclops/Knight, emerged in February 2024 and by August had victimized at least 210 organizations across critical sectors using multiple vulnerability exploits and a double-extortion modelhttps://www.cisa.gov/news-events/cybersecurity-advisories/aa24-242a#:~:text=The%20Federal%20Bureau%20of%20Investigation,such%20as%20LockBit%20and%20ALPHVhttps://www.cisa.gov/news-events/cybersecurity-advisories/aa24-242a#:~:text=RansomHub%20affiliates%20typically%20compromise%20internet,following%20CVEs%20have%20been%20observed."
MAL-2024-11-08,Black Basta,Ransomware,2022-04-20,ongoing,"[""CVE-2024-1709""]","[""T1059"", ""T1078"", ""T1486""]","[""Spearphishing"", ""Exploiting Vulnerabilities"", ""Double Extortion""]","{""ransom_note"": ""unique code with Tor URL"", ""use_email_bombing"": true}","[""Phishing"", ""Abusing Valid Accounts"", ""Exploiting ConnectWise ScreenConnect""]","[""Backdoor Accounts""]","[""Manufacturing"", ""Finance"", ""Healthcare"", ""Critical Infrastructure"", ""Construction"", ""Agriculture""]",500.0,"[""US"", ""EU"", ""AU""]","{""victims"": 500}",,,,"[""Tor"", ""Dark Web""]","[""CISA"", ""FBI"", ""NCSC""]","Patch ConnectWise CVE-2024-1709, implement MFA, monitor for suspicious remote access, enforce least privilege.","[""https://www.cisa.gov/sites/default/files/2024-11/aa24-131a_black_basta.pdf""]",0.9,"As of May 2024, Black Basta impacted more than 500 organizations worldwide; affiliates use spear phishing and exploit vulnerabilities like ConnectWise ScreenConnect, employing double extortion and new social engineering techniqueshttps://www.cisa.gov/news-events/cybersecurity-advisories/aa24-131a#:~:text=provide%20information%20on%20Black%20Basta%2C,HPH%29%20Sectorhttps://www.cisa.gov/news-events/cybersecurity-advisories/aa24-131a#:~:text=Starting%20in%20February%202024%2C%20Black,T1078%20%28link%20is%20external."
MAL-2024-04-30,Rhysida,Ransomware,2023-05-15,ongoing,"[""CVE-2020-1472""]","[""T1078"", ""T1133"", ""T1490""]","[""VPN Credential Compromise"", ""Zerologon Exploitation"", ""Living-off-the-land""]","{""tools"": [""AZCopy"", ""StorageExplorer""], ""double_extortion"": true}","[""Compromised VPN Credentials"", ""Phishing""]","[""Domain Accounts"", ""Scheduled Tasks""]","[""Education"", ""Healthcare"", ""Manufacturing"", ""IT"", ""Government""]",,"[""US"", ""EU""]",{},,,,"[""Tor""]","[""CISA"", ""FBI""]","Implement MFA for VPN, patch Zerologon, monitor for AZCopy usage.","[""https://www.cisa.gov/sites/default/files/2025-04/aa25-xxx_stopransomware_rhysida_update.pdf""]",0.8,"By April 2025, Rhysida operators continued to target multiple sectors and used cloud storage tools like AZCopy to exfiltrate data after compromising VPN credentialshttps://www.cisa.gov/news-events/cybersecurity-advisories/aa23-319a#:~:text=December%202024,of%20samples%20discovered%20on%20victimhttps://www.cisa.gov/news-events/cybersecurity-advisories/aa23-319a#:~:text=Initial%20Access."
MAL-2024-04-01,BianLian,Ransomware,2022-06-15,ongoing,"[""CVE-2021-34473"", ""CVE-2021-34523"", ""CVE-2021-31207""]","[""T1566"", ""T1078"", ""T1027""]","[""Phishing"", ""ProxyShell Exploitation"", ""Data Exfiltration""]","{""shift"": ""Exfiltration-only"", ""tools"": [""RClone"", ""Mega""]}","[""RDP Credential Abuse"", ""Phishing""]","[""Domain Accounts"", ""Backdoor""]","[""Healthcare"", ""Critical Infrastructure"", ""Professional Services""]",,"[""US"", ""AU""]",{},,,,"[""Mega"", ""RClone""]","[""CISA"", ""FBI""]","Patch ProxyShell vulnerabilities, enforce MFA on RDP, monitor file transfer utilities.","[""https://www.cisa.gov/sites/default/files/2024-04/aa24-xxx_stopransomware_bianlian_update.pdf""]",0.8,"BianLian continued its data extortion-only model in 2024, targeting organizations through compromised RDP and ProxyShell vulnerabilitieshttps://www.cisa.gov/news-events/cybersecurity-advisories/aa23-136a#:~:text=group,BianLian%20actors%20warn%20of%20financialhttps://www.cisa.gov/news-events/cybersecurity-advisories/aa23-136a#:~:text=,T1190%20%28link%20is%20external."
MAL-2024-06-04,Play,Ransomware,2022-06-01,ongoing,"[""CVE-2023-4966"", ""CVE-2024-57727"", ""CVE-2022-41080"", ""CVE-2022-41082""]","[""T1078"", ""T1566"", ""T1486""]","[""Abuse of Valid Accounts"", ""Exploitation of Fortinet and Exchange Vulnerabilities"", ""Intermittent Encryption""]","{""encryption"": ""AES-256, RSA-4096"", ""ransom_note"": "".PLAY""}","[""Valid Accounts"", ""Phishing"", ""Supply-chain vulnerabilities""]","[""Cobalt Strike"", ""SystemBC""]","[""Government"", ""Finance"", ""Manufacturing"", ""Healthcare""]",900.0,"[""Global""]","{""victims"": 900}",,,,"[""Tor"", ""Darknet""]","[""CISA"", ""Trend Micro""]","Apply patches for Fortinet and Exchange vulnerabilities, monitor remote management tools, enforce strong passwords and MFA.","[""https://www.cisa.gov/sites/default/files/2025-06/aa25-xxx_stopransomware_play_update.pdf""]",0.8,"By mid-2025, Play ransomware had affected around 900 entities globally; it exploits Fortinet, Exchange, and remote management vulnerabilities and employs intermittent encryption and double extortionhttps://www.cisa.gov/news-events/cybersecurity-advisories/aa23-352a#:~:text=Initial%20Accesshttps://www.cisa.gov/news-events/alerts/2025/06/04/updated-guidance-play-ransomware#:~:text=Read%20Full%20Advisory%20Text."
MAL-2025-03-12,Medusa,Ransomware,2021-12-01,ongoing,"[""CVE-2024-1709"", ""CVE-2023-48788""]","[""T1566"", ""T1078"", ""T1486""]","[""Initial Access Brokers"", ""Phishing"", ""SQL Injection""]","{""language"": ""Golang"", ""extortion"": ""Double""}","[""Phishing"", ""Use of Initial Access Brokers"", ""Exploiting ScreenConnect and FortiClient EMS SQL injection""]","[""Living-off-the-land"", ""Credential Abuse""]","[""Healthcare"", ""Education"", ""Legal"", ""Insurance"", ""Technology"", ""Manufacturing""]",300.0,"[""Global""]","{""victims"": 300}",,,,"[""Tor""]","[""CISA"", ""FBI""]","Patch ScreenConnect and Fortinet vulnerabilities, monitor for living-off-the-land tools, restrict RDP.","[""https://www.cisa.gov/sites/default/files/2025-03/aa25-xxx_stopransomware_medusa.pdf""]",0.8,"The March 12, 2025 advisory states Medusa ransomware (distinct from MedusaLocker) impacted over 300 victims across various sectors and exploits CVE-2024-1709 and CVE-2023-48788, using double extortionhttps://www.cisa.gov/news-events/cybersecurity-advisories/aa25-071a#:~:text=Center%20%28MS,as%20recently%20as%20February%202025https://www.cisa.gov/news-events/cybersecurity-advisories/aa25-071a#:~:text=Medusa%20developers%20typically%20recruit%20initial,of%20common%20techniques%2C%20such%20as."
MAL-2025-06-04,Play,Ransomware,2022-06-01,ongoing,"[""CVE-2023-4966"", ""CVE-2024-57727"", ""CVE-2022-41080"", ""CVE-2022-41082""]","[""T1078"", ""T1566"", ""T1486""]","[""Abuse of Valid Accounts"", ""Exploitation of Fortinet and Exchange Vulnerabilities"", ""Double Extortion""]","{""encryption"": ""AES-256, RSA"", ""variant"": ""ESXi variant with intermittent encryption""}","[""Valid Accounts"", ""Phishing"", ""Exploitation of remote management""]","[""Cobalt Strike"", ""SystemBC""]","[""Government"", ""Finance"", ""Manufacturing"", ""Healthcare""]",900.0,"[""Global""]","{""victims"": 900}",,,,"[""Tor"", ""Dark Web""]","[""CISA"", ""Trend Micro""]","Patch Fortinet and Microsoft Exchange vulnerabilities, monitor remote management tools, enforce MFA and strong passwords.","[""https://www.cisa.gov/sites/default/files/2025-06/aa25-xxx_stopransomware_play_update.pdf""]",0.8,"As of June 2025, Play ransomware had affected about 900 entities worldwide and continues to exploit Fortinet, Exchange, and remote management vulnerabilities with intermittent encryptionhttps://www.cisa.gov/news-events/cybersecurity-advisories/aa23-352a#:~:text=Initial%20Accesshttps://www.cisa.gov/news-events/alerts/2025/06/04/updated-guidance-play-ransomware#:~:text=Read%20Full%20Advisory%20Text."
MAL-2025-07-22,Interlock,Ransomware,2024-09-30,ongoing,[],"[""T1189"", ""T1566"", ""T1486""]","[""Drive-by Download"", ""Social Engineering (ClickFix)"", ""Double Extortion""]","{""unique_feature"": ""Encrypts hypervisor-level virtual machines"", ""payloads"": [""Interlock RAT"", ""NodeSnake RAT""], ""delivery"": ""Fake browser updates""}","[""Malicious Browser Update"", ""Fake CAPTCHA (ClickFix)""]","[""Cobalt Strike"", ""SystemBC""]","[""Business"", ""Critical Infrastructure"", ""IT""]",,"[""US"", ""EU""]",{},,,,"[""Tor"", ""Azure Storage""]","[""CISA"", ""Private Researchers""]","Block unknown browser updates, warn users about ClickFix scams, monitor for Azure Storage tool misuse.","[""https://www.cisa.gov/sites/default/files/2025-07/aa25-203a_stopransomware_interlock.pdf""]",0.8,Interlock ransomware first observed in late September 2024 targets businesses and critical infrastructure; it uses fake browser updates and the ClickFix CAPTCHA to deliver malware and encrypts virtual machines for double extortionhttps://www.cisa.gov/news-events/cybersecurity-advisories/aa25-203a#:~:text=The%20Interlock%20ransomware%20variant%20was
MAL-2025-04-30,Rhysida,Ransomware,2023-05-15,ongoing,"[""CVE-2020-1472""]","[""T1078"", ""T1133"", ""T1490""]","[""VPN Credential Compromise"", ""Zerologon Exploitation"", ""Use of AZCopy""]","{""tools"": [""AZCopy"", ""StorageExplorer""], ""double_extortion"": true}","[""Compromised VPN Credentials"", ""Phishing""]","[""Domain Accounts"", ""Scheduled Tasks""]","[""Education"", ""Healthcare"", ""Manufacturing"", ""IT"", ""Government""]",,"[""US"", ""EU""]",{},,,,"[""Tor""]","[""CISA"", ""FBI""]","Implement MFA for VPN, patch Zerologon, monitor for AZCopy usage.","[""https://www.cisa.gov/sites/default/files/2025-04/aa25-xxx_stopransomware_rhysida_update.pdf""]",0.8,"The April 30, 2025 update indicates Rhysida continues to target multiple sectors and uses cloud storage tools like AZCopy for data exfiltrationhttps://www.cisa.gov/news-events/cybersecurity-advisories/aa23-319a#:~:text=December%202024,of%20samples%20discovered%20on%20victimhttps://www.cisa.gov/news-events/cybersecurity-advisories/aa23-319a#:~:text=Initial%20Access."
