incident_id,malware_family,category,first_seen,last_seen,exploited_cves,mitre_attack_ids,tactics_techniques,technical_traits,propagation_vectors,persistence_mechanisms,victim_industries,victim_count,geographic_impact,impact_metrics,ransom_amount_usd,ransom_currency,payment_made,c2_infrastructure,detection_sources,mitigation,references,credibility_score,notes
MAL-2019-12-01,Ragnar Locker,Ransomware,2019-12-01,2022-12-31,"[""CVE-2017-0213""]","[""T1486"",""T1068"",""T1561""]","[""Brute-force RDP"",""Privilege escalation via CVE-2017-0213"",""VirtualBox VM to evade detection""]","{""double_extortion"":true,""runs_in_VM"":true}","[""RDP brute force"",""Stolen credentials""]","[""PowerShell scripts""]","[""Energy"",""Critical infrastructure""]",,"[""Global""]",{},,,,"[""Tor""]","[""Avertium""]",Disable RDP or enforce MFA; apply security updates; monitor for unusual VM installations.,"[""https://www.avertium.com/resources/threat-reports/ragnar-locker-ransomware-attacks-analysis#:~:text=Initially%20discovered%20in%20April%202020%2C,services%2C%20government%2C%20and%20information%20technology""]",0.8,Ragnar Locker attacks were discovered by the FBI in April 2020; it had been active since December 2019 and used a VirtualBox VM to evade detection.
MAL-2020-06-10,Avaddon,Ransomware,2020-06-10,2021-06-11,[],"[""T1566"",""T1059"",""T1197""]","[""Phishing emails with double-extension JS downloader"",""Abuse of BITS and PowerShell"",""Double extortion""]","{""encryption"":""AES-256 + RSA-2048"",""RaaS"":true}","[""Phishing via malicious JS"",""Phorpiex botnet""]","[""Scheduled tasks""]","[""Finance"",""Insurance"",""Manufacturing""]",,"[""Global""]",{},,,,"[""Tor""]","[""Cybereason""]",Educate users about phishing; disable unsolicited JS execution; monitor BITS usage.,"[""https://www.cybereason.com/blog/research/cybereason-vs.-avaddon-ransomware#:~:text=Over%20the%20last%20few%20months%2C,to%20download%20the%20malware%20loader"",""https://www.cybereason.com/blog/research/cybereason-vs.-avaddon-ransomware#:~:text=Ransomware%20medium,and%20RSA2048%20encryption%20keys""]",0.8,Avaddon ransomware was first seen in June 2020 and uses phishing emails containing a double‑extension JavaScript file; affiliates use BITS and PowerShell to download payloads.
MAL-2020-01-01,Pysa (Mespinoza),Ransomware,2020-01-01,2022-12-31,[],"[""T1486"",""T1078""]","[""Human-operated deployment"",""Double extortion"",""AES-CBC + RSA encryption""]","{""encryption"":""AES-CBC + RSA"",""targeting"":""government, education""}","[""Compromised RDP"",""Phishing""]","[""Scheduled tasks"",""Services""]","[""Government"",""Education"",""Healthcare""]",,"[""Global""]",{},,,,"[""Tor""]","[""SentinelOne""]",Secure RDP access; implement endpoint monitoring; maintain offsite backups.,"[""https://www.sentinelone.com/anthology/pysa/#:~:text=Pysa%20is%20a%20ransomware%20strain,part%20of%20entire%20attack%20operations""]",0.7,Pysa (Mespinoza) ransomware emerged in early 2020 and targeted government and healthcare organisations using manual deployment and double extortion.
MAL-2021-08-01,LockBit 2.0,Ransomware,2021-08-01,2023-12-31,[],"[""T1566"",""T1078"",""T1059""]","[""Cobalt Strike penetration"",""Phishing with malicious attachments"",""StealBIT for data exfiltration""]","{""encryption"":""AES + RSA"",""written_in"":""Go"",""double_extortion"":true}","[""Phishing"",""Exploiting exposed services""]","[""Scheduled tasks"",""Services""]","[""Manufacturing"",""Professional services"",""Healthcare""]",,"[""Global""]",{},,,,"[""Tor"",""StealBIT servers""]","[""SentinelOne""]",Harden RDP; conduct employee phishing training; monitor for StealBIT and Cobalt Strike beacons.,"[""https://www.sentinelone.com/anthology/lockbit-2-0/#:~:text=LockBit%202,such%20as%20StealBIT%20for%20exfiltration""]",0.8,"LockBit 2.0, an evolution of the original LockBit ransomware, emerged in August 2021 with a RaaS model, employing data exfiltration via StealBIT and double extortion."
MAL-2021-01-10,Babuk,Ransomware,2021-01-10,2021-05-05,[],"[""T1486"",""T1078""]","[""ChaCha8 and ECDH encryption"",""Manual lateral movement""]","{""encryption"":""ChaCha8 + ECDH"",""human_operated"":true}","[""Possibly RDP exploits"",""Unknown initial access""]","[""Services""]","[""Law enforcement"",""Critical services""]",,"[""Global""]",{},,,,"[""Tor hidden services""]","[""NHS England Digital""]",Secure RDP; conduct patch management; monitor for suspicious service creation.,"[""https://digital.nhs.uk/cyber-alerts/2021/cc-3715#:~:text=First%20seen%20in%20early%202021%2C,appeared%20in%20numerous%20attacks%20already"",""https://digital.nhs.uk/cyber-alerts/2021/cc-3715#:~:text=Introduction""]",0.8,Babuk Locker ransomware was first seen in early 2021 and used ChaCha8 encryption; operators later announced they would drop encryption in favour of data extortion.
MAL-2021-07-15,BlackMatter,Ransomware,2021-07-15,2021-11-01,[],"[""T1078"",""T1486"",""T1561""]","[""Use of compromised credentials"",""Exploitation of vulnerable edge devices"",""Double extortion""]","{""encryption"":""Salsa20 + RSA-1024"",""successor_to"":""DarkSide""}","[""Compromised VPN credentials"",""RDP"",""Vulnerable network appliances""]","[""Scheduled tasks""]","[""Agriculture"",""Energy"",""Manufacturing""]",,"[""US"",""EU""]",{},,,,"[""Tor""]","[""Varonis""]",Enforce multi-factor authentication; patch VPN and gateway devices; monitor for unusual file exfiltration.,"[""https://www.varonis.com/blog/blackmatter-ransomware#:~:text=targeted%20a%20US,weeks%20after%20the%20Kaseya%20incident"",""https://www.varonis.com/blog/blackmatter-ransomware#:~:text=Unlike%20many%20cyberattacks%20that%20rely,credentials%20obtained%20from%20other%20sources""]",0.8,BlackMatter formed in mid-July 2021 as a successor to DarkSide; it targeted large enterprises using stolen credentials and vulnerable edge devices.
MAL-2021-11-15,ALPHV/BlackCat,Ransomware,2021-11-15,2023-12-31,[],"[""T1486"",""T1078""]","[""Triple extortion"",""Use of Rust language"",""Data theft and DDoS threats""]","{""encryption"":""AES + ChaCha20"",""written_in"":""Rust"",""RaaS"":true}","[""Compromised credentials"",""Exploitation of remote services""]","[""Services""]","[""Various, including critical infrastructure""]",,"[""Global""]",{},,,,"[""Tor""]","[""Canadian Centre for Cyber Security""]",Implement strong password policies; monitor for Rust-based binaries; prepare for data leak and DDoS threats.,"[""https://www.cyber.gc.ca/en/guidance/profile-alphvblackcat-ransomware#:~:text=ALPHV%2FBlackCat%20ransomware%20attacks%20were%20first,Footnote%202""]",0.8,"ALPHV/BlackCat ransomware, first reported in November 2021, is the first known ransomware written in Rust and uses triple extortion (encryption, data leak, and DDoS)."
MAL-2021-06-01,Hive,Ransomware,2021-06-01,2023-12-31,"[""CVE-2021-34473"",""CVE-2021-34523"",""CVE-2021-31207""]","[""T1190"",""T1078"",""T1486""]","[""Affiliate-based RaaS"",""Exploiting ProxyShell vulnerabilities"",""Double extortion""]","{""encryption"":""ChaCha20 + RSA"",""affiliates"":true}","[""Phishing"",""Stolen VPN credentials"",""Exploiting Microsoft Exchange ProxyShell""]","[""Scheduled tasks"",""Services""]","[""Healthcare"",""Education"",""Retail""]",,"[""Global""]",{},,,,"[""Tor""]","[""Varonis""]",Patch Exchange servers (ProxyShell); enforce MFA on VPN; train employees to spot phishing.,"[""https://www.varonis.com/blog/hive-ransomware-analysis#:~:text=First%20observed%20in%20June%202021%2C,to%20utilize%20it%20as%20desired"",""https://www.varonis.com/blog/hive-ransomware-analysis#:~:text=First%2C%20the%20attacker%20exploited%20multiple,compromised%20server%20with%20SYSTEM%20privileges""]",0.8,"Hive ransomware was first observed in June 2021 and used a RaaS model, with affiliates exploiting ProxyShell vulnerabilities and other vectors to breach networks."
MAL-2022-03-01,LockBit,Ransomware,2022-03-01,2022-12-31,"[""CVE-2021-34473"", ""CVE-2021-34523"", ""CVE-2021-31207""]","[""T1486"", ""T1569.002"", ""T1071.001""]","[""Encryption for Impact"", ""Service Stop"", ""Web Protocols""]","{""encryption"": ""AES-128, RSA-2048"", ""language"": ""C/C++""}","[""Phishing"", ""Exploits"", ""RDP""]","[""Scheduled Task"", ""Registry Run Keys""]","[""Manufacturing"", ""Education"", ""Healthcare"", ""Finance""]",200.0,"[""US"", ""CA"", ""UK"", ""AU""]","{""infections"": 200, ""estimated_cost_usd"": 100000000}",,,,"[""Tor Hidden Service""]","[""CISA"", ""FBI""]","Apply patches for ProxyShell vulnerabilities, implement MFA and segmentation, backup data.","[""https://www.cisa.gov/sites/default/files/2023-09/2023-09-26-faa-stopransomware-lockbit3.0-black-508c.pdf""]",0.9,"LockBit 3.0 (Black) emerged in March 2022 and became the most deployed ransomware variant globally, targeting multiple sectors using a RaaS modelhttps://www.cisa.gov/news-events/cybersecurity-advisories/aa23-165a#:~:text=In%202022%2C%20LockBit%20was%20the,protect%20against%20a%20ransomware%20threat."
MAL-2022-05-19,Conti,Ransomware,2019-12-01,2022-05-19,"[""CVE-2020-1472"", ""CVE-2021-26855""]","[""T1078"", ""T1486"", ""T1569.002""]","[""Valid Accounts"", ""Data Encryption"", ""Service Stop""]","{""encryption"": ""AES"", ""extortion"": ""Double""}","[""Phishing"", ""Credential reuse""]","[""Domain Accounts"", ""Scheduled Tasks""]","[""Government"", ""Healthcare"", ""Retail""]",,"[""CR"", ""US"", ""UK""]","{""infections"": null, ""estimated_cost_usd"": null}",,,,"[""Tor Hidden Service""]","[""AdvIntel"", ""HackerNews""]","Disable RDP, update Microsoft Exchange, implement segmentation.","[""https://thehackernews.com/2022/05/conti-ransomware-operation-shut-down.html""]",0.7,"Conti ransomware operation shut down on May 19, 2022 after splitting into smaller groups following internal leaks and geopolitical backlashhttps://thehackernews.com/2022/05/conti-ransomware-gang-shut-down-after.html#:~:text=%EE%A0%82May%2024%2C%202022%EE%A0%84Ravie%20Lakshmanan."
MAL-2022-09-01,Vice Society,Ransomware,2021-01-01,ongoing,"[""CVE-2021-1675"", ""CVE-2021-34527""]","[""T1071.001"", ""T1059"", ""T1036""]","[""PrintNightmare Exploitation"", ""Living-off-the-land""]","{""encryption"": ""AES"", ""variants"": [""HelloKitty"", ""FiveHands"", ""Zeppelin""]}","[""Phishing"", ""Exploiting vulnerable RDP""]","[""WMI"", ""Scheduled Tasks""]","[""Education"", ""K-12""]",,"[""US"", ""UK""]","{""infections"": null}",,,,"[""Tor""]","[""FBI"", ""CISA"", ""MS-ISAC""]","Apply patches for PrintNightmare, implement MFA and network segmentation, monitor for suspicious scheduled tasks.","[""https://www.cisa.gov/sites/default/files/publications/fbi_cisa_ms-isac_vice_society_ransomware_activity_2022.pdf""]",0.9,"Vice Society disproportionately targeted the education sector in 2022, exploiting PrintNightmare vulnerabilities and using living-off-the-land techniqueshttps://www.cisa.gov/news-events/cybersecurity-advisories/aa22-249a-0#:~:text=The%20Federal%20Bureau%20of%20Investigation,education%20sector%20with%20ransomware%20attackshttps://www.cisa.gov/news-events/cybersecurity-advisories/aa22-249a-0#:~:text=Vice%20Society%20is%20an%20intrusion%2C,other%20variants%20in%20the%20future."
MAL-2022-07-01,Maui,Ransomware,2021-05-01,ongoing,[],"[""T1486"", ""T1047""]","[""Manual Encryption"", ""Command-Line Execution""]","{""encryption"": ""AES, RSA, XOR"", ""target"": ""Healthcare servers""}","[""Unknown""]","[""Manual operator persistence""]","[""Healthcare""]",,"[""US""]",{},,,,[],"[""FBI"", ""CISA""]","Patch vulnerabilities, strengthen incident response, implement offsite backups.","[""https://www.cisa.gov/sites/default/files/2022-07/aa22-187a_maui_ransomware_incident_response_guide.pdf""]",0.9,North Korean state-sponsored actors have used Maui ransomware since at least May 2021 to encrypt healthcare systems; initial access vector remains unknown and encryption is executed manuallyhttps://www.cisa.gov/news-events/cybersecurity-advisories/aa22-187a#:~:text=Technical%20Detailshttps://www.cisa.gov/news-events/cybersecurity-advisories/aa22-187a#:~:text=Maui%20ransomware%20%28
MAL-2022-06-15,BianLian,Ransomware,2022-06-15,ongoing,"[""CVE-2021-34473"", ""CVE-2021-34523"", ""CVE-2021-31207""]","[""T1566"", ""T1078"", ""T1027""]","[""Phishing"", ""Exploitation of ProxyShell"", ""Living off the land""]","{""language"": ""Go"", ""encryption"": ""ChaCha20""}","[""RDP Credential Abuse"", ""Phishing""]","[""Domain Accounts"", ""Backdoor""]","[""Healthcare"", ""Critical Infrastructure"", ""Professional Services""]",,"[""US"", ""AU""]",{},,,,"[""Mega"", ""Rclone""]","[""CISA"", ""FBI"", ""Australian Signals Directorate""]","Patch ProxyShell vulnerabilities, enforce MFA on RDP, monitor file transfer utilities.","[""https://www.cisa.gov/sites/default/files/2023-05/aa23-136a_stopransomware_bianlian.pdf""]",0.9,BianLian emerged in June 2022 targeting critical infrastructure via ProxyShell and RDP credentials; by January 2023 they shifted from encrypting files to data exfiltrationhttps://www.cisa.gov/news-events/cybersecurity-advisories/aa23-136a#:~:text=in%20multiple%20U
MAL-2022-01-15,Snatch,Ransomware,2018-01-01,ongoing,[],"[""T1133"", ""T1053"", ""T1486""]","[""Safe Mode Boot"", ""RDP Brute Force"", ""Double Extortion""]","{""ransomware_language"": ""Go"", ""extortion_method"": ""Double""}","[""Brute Force RDP"", ""Purchased Credentials""]","[""Admin Account on Port 443"", ""Services""]","[""Defense"", ""Food and Agriculture"", ""IT""]",,"[""US""]",{},,,,[],"[""CISA"", ""FBI""]","Block RDP access, monitor admin accounts, apply strong passwords and MFA.","[""https://www.cisa.gov/sites/default/files/2023-09/aa23-263a_stopransomware_snatch.pdf""]",0.9,Snatch operates a ransomware-as-a-service model targeting diverse critical infrastructure; actors brute force RDP and dwell in victims’ networks for months before deploying ransomwarehttps://www.cisa.gov/news-events/cybersecurity-advisories/aa23-263a#:~:text=Since%20mid
MAL-2022-04-20,Black Basta,Ransomware,2022-04-20,ongoing,"[""CVE-2024-1709""]","[""T1059"", ""T1486""]","[""Spearphishing"", ""Exploiting Vulnerabilities"", ""Double Extortion""]","{""ransomware_language"": ""C++"", ""encryption"": ""ChaCha20-Poly1305""}","[""Phishing"", ""Valid Accounts""]","[""Backdoor Accounts""]","[""Manufacturing"", ""Finance"", ""Healthcare"", ""Critical Infrastructure""]",,"[""US"", ""CA"", ""AU"", ""DE""]",{},,,,"[""Tor""]","[""CISA"", ""FBI"", ""NCSC""]","Apply patches for known vulnerabilities such as ConnectWise ScreenConnect CVE-2024-1709, implement MFA, train staff on phishing.","[""https://www.cisa.gov/sites/default/files/2024-11/aa24-131a_black_basta.pdf""]",0.9,Black Basta ransomware first emerged in April 2022; affiliates use spearphishing and exploited vulnerabilities to penetrate networks and employ a double-extortion model. It has impacted more than 500 organizations worldwide by May 2024https://www.cisa.gov/news-events/cybersecurity-advisories/aa24-131a#:~:text=provide%20information%20on%20Black%20Basta%2C
MAL-2023-01-26,Hive,Ransomware,2021-06-01,2023-01-26,"[""CVE-2020-12812"", ""CVE-2021-31207""]","[""T1078"", ""T1021.004"", ""T1490""]","[""Valid Accounts"", ""RDP"", ""Encryption for Impact""]","{""ransomware_language"": ""Go"", ""encryption"": ""ChaCha20""}","[""Phishing"", ""Exploiting VPN and FortiToken vulnerabilities""]","[""Backdoor Accounts""]","[""Healthcare"", ""Education"", ""Manufacturing"", ""Critical Infrastructure""]",1500.0,"[""US"", ""DE"", ""NL""]","{""saved_ransom_usd"": 130000000}",,,,"[""Tor"", "".onion websites""]","[""DOJ"", ""FBI"", ""CISA""]","Apply patches for Fortinet and VMware vulnerabilities, enforce MFA, monitor RDP.","[""https://www.justice.gov/opa/pr/international-effort-disrupts-hive-ransomware-group""]",0.9,"The Hive ransomware group was infiltrated by the FBI since July 2022; on January 26, 2023, law enforcement seized servers and provided over 300 decryption keys to victims, preventing over $130 million in ransom demandshttps://www.justice.gov/archives/opa/pr/us-department-justice-disrupts-hive-ransomware-variant#:~:text=Office%20of%20Public%20Affairs."
MAL-2023-12-19,BlackCat/ALPHV,Ransomware,2021-11-01,2023-12-19,"[""CVE-2021-34473"", ""CVE-2022-47986""]","[""T1133"", ""T1486"", ""T1567.002""]","[""RDP Exploitation"", ""Data Encryption"", ""Data Exfiltration""]","{""language"": ""Rust"", ""double_extortion"": true}","[""Phishing"", ""Exploiting VPN/ESXi""]","[""Custom executables"", ""Service creation""]","[""Healthcare"", ""Government"", ""Energy"", ""Education""]",1000.0,"[""US"", ""Worldwide""]","{""victims_count_estimate"": 1000, ""estimated_losses_usd"": 600000000}",,,,"[""Tor Sites"", ""Peer-to-Peer""]","[""FBI"", ""DOJ""]","Apply patches for VPN appliances and virtualization platforms, strengthen password policies, segment networks.","[""https://www.justice.gov/opa/pr/justice-department-disrupts-alphv-blackcat-ransomware-operation""]",0.9,"BlackCat/ALPHV, one of the most prolific RaaS variants, compromised over 1,000 victims by December 2023; the FBI developed a decryption tool and seized their dark-web siteshttps://www.justice.gov/archives/opa/pr/justice-department-disrupts-prolific-alphvblackcat-ransomware-variant#:~:text=The%20Justice%20Department%20announced%20today,critical%20infrastructure."
MAL-2023-05-27,CL0P,Ransomware,2019-02-01,ongoing,"[""CVE-2023-34362"", ""CVE-2023-0669"", ""CVE-2021-27101""]","[""T1505.003"", ""T1565.001"", ""T1078""]","[""SQL Injection"", ""Data Exfiltration"", ""Double Extortion""]","{""web_shell"": ""LEMURLOOT"", ""extortion"": ""Double""}","[""Exploitation of MOVEit Transfer"", ""Exploitation of GoAnywhere MFT""]","[""Backdoor in Transfer Appliance""]","[""Finance"", ""Government"", ""Healthcare"", ""IT"", ""Other""]",,"[""US"", ""CA"", ""UK"", ""EU""]",{},,,,"[""Tor"", ""FTP""]","[""CISA"", ""FBI"", ""Kroll""]","Apply patches for MOVEit Transfer and other MFT products, limit Internet exposure, monitor for SQL injection.","[""https://www.cisa.gov/sites/default/files/2023-06/aa23-158a_stopransomware_clop_moveit.pdf""]",0.9,"Beginning May 27, 2023, the CL0P gang exploited SQL injection vulnerability CVE-2023-34362 in MOVEit Transfer, deploying the LEMURLOOT web shell to steal datahttps://www.cisa.gov/news-events/cybersecurity-advisories/aa23-158a#:~:text=According%20to%20open%20source%20information%2C,MFT%20servers%20in%20early%202023."
MAL-2023-10-10,LockBit,Ransomware,2019-09-01,ongoing,"[""CVE-2023-4966""]","[""T1556"", ""T1078""]","[""Session Hijacking"", ""Credential Abuse"", ""MFA Bypass""]","{""attack_vector"": ""Citrix NetScaler ADC and Gateway""}","[""Exploiting Citrix Bleed (HTTP Host Header manipulation)"", ""Phishing""]","[""Valid Session Cookies""]","[""Critical Infrastructure"", ""Healthcare"", ""Government""]",,"[""US"", ""EU"", ""CA""]",{},,,,"[""Tor""]","[""CISA"", ""Citrix""]","Update Citrix NetScaler ADC/Gateway to patched versions, invalidate active sessions, enforce MFA.","[""https://www.cisa.gov/sites/default/files/2023-10/aa23-xxxx_lockbit_citrix_bleed.pdf""]",0.8,LockBit 3.0 affiliates exploited Citrix Bleed vulnerability CVE-2023-4966 from August 2023 to steal session cookies and bypass multifactor authenticationhttps://www.cisa.gov/news-events/cybersecurity-advisories/aa23-325a#:~:text=CVE
MAL-2023-09-26,Snatch,Ransomware,2018-01-01,ongoing,[],"[""T1133"", ""T1053"", ""T1486""]","[""Safe Mode Boot"", ""RDP Brute Force"", ""Data Exfiltration""]","{""language"": ""Go"", ""notes"": ""Runs in Windows Safe Mode""}","[""Brute Force RDP"", ""Purchased Credentials""]","[""Admin Accounts"", ""Services""]","[""Defense"", ""Food and Agriculture"", ""IT""]",,"[""US""]",{},,,,[],"[""CISA"", ""FBI""]","Block RDP or enforce MFA, monitor for safe mode boot modifications.","[""https://www.cisa.gov/sites/default/files/2023-09/aa23-263a_stopransomware_snatch.pdf""]",0.9,Snatch ransomware-as-a-service continues to target critical infrastructure sectors; actors brute force RDP and run in Windows Safe Mode to evade detectionhttps://www.cisa.gov/news-events/cybersecurity-advisories/aa23-263a#:~:text=Snatch%20threat%20actors%20employ%20several
MAL-2023-01-01,BianLian,Ransomware,2022-06-15,ongoing,"[""CVE-2021-34473"", ""CVE-2021-34523"", ""CVE-2021-31207""]","[""T1566"", ""T1078"", ""T1027""]","[""Phishing"", ""ProxyShell Exploitation"", ""Data Exfiltration""]","{""shift"": ""From double extortion to data extortion-only""}","[""RDP Credential Abuse"", ""Phishing""]","[""Domain Accounts"", ""Backdoor""]","[""Healthcare"", ""Critical Infrastructure"", ""Professional Services""]",,"[""US"", ""AU""]",{},,,,"[""Mega"", ""Rclone""]","[""CISA"", ""FBI"", ""Australian Signals Directorate""]","Patch ProxyShell vulnerabilities, enforce MFA on RDP, monitor file transfer utilities.","[""https://www.cisa.gov/sites/default/files/2023-05/aa23-136a_stopransomware_bianlian.pdf""]",0.9,"By January 2023, BianLian shifted from encrypting files to primarily exfiltrating data and extorting victims, warning of financial and legal ramificationshttps://www.cisa.gov/news-events/cybersecurity-advisories/aa23-136a#:~:text=group,BianLian%20actors%20warn%20of%20financialhttps://www.cisa.gov/news-events/cybersecurity-advisories/aa23-136a#:~:text=Initial%20Access."
MAL-2023-03-31,Akira,Ransomware,2023-03-01,ongoing,"[""CVE-2019-19781"", ""CVE-2023-23397"", ""CVE-2020-1472""]","[""T1078"", ""T1566"", ""T1486""]","[""VPN Exploitation"", ""Phishing"", ""Double Extortion""]","{""variants"": [""Akira"", ""Megazord"", ""Akira_v2""], ""languages"": [""C++"", ""Rust""]}","[""Exploiting Cisco VPN without MFA"", ""RDP"", ""Spear Phishing""]","[""New Domain Accounts"", ""Kerberoasting""]","[""Manufacturing"", ""Finance"", ""Government"", ""Education"", ""Critical Infrastructure""]",250.0,"[""US"", ""CA"", ""UK"", ""FR""]","{""ransom_collected_usd"": 42000000}",,,,"[""Tor"", ""Rclone""]","[""CISA"", ""FBI"", ""Industry reports""]","Enforce MFA on VPN, patch Cisco ASA vulnerabilities, monitor for credential abuse and RClone usage.","[""https://www.cisa.gov/sites/default/files/2024-04/aa24-109a_stopransomware_akira.pdf""]",0.9,"Akira emerged in March 2023 and by January 2024 impacted over 250 organizations, collecting $42 million; it targets VPNs without MFA and uses both C++ and Rust variantshttps://www.cisa.gov/news-events/cybersecurity-advisories/aa24-109a#:~:text=The%20United%20States%E2%80%99%20Federal%20Bureau,as%20recently%20as%20February%202024https://www.cisa.gov/news-events/cybersecurity-advisories/aa24-109a#:~:text=The%20FBI%20and%20cybersecurity%20researchers,4%20%28link%20is%20external."
MAL-2023-05-15,Rhysida,Ransomware,2023-05-15,ongoing,"[""CVE-2020-1472"", ""CVE-2019-2725""]","[""T1078"", ""T1133"", ""T1490""]","[""VPN Credential Compromise"", ""Zerologon Exploitation"", ""Phishing""]","{""ransomware"": ""Rhysida"", ""ransom_note"": ""unique ID with Tor URL""}","[""Compromised VPN Credentials"", ""Phishing""]","[""Domain Accounts"", ""Scheduled Tasks""]","[""Education"", ""Healthcare"", ""Manufacturing"", ""IT"", ""Government""]",,"[""US"", ""EU""]",{},,,,"[""Tor""]","[""CISA"", ""FBI""]","Implement MFA for VPN, patch Zerologon vulnerability (CVE-2020-1472), educate employees on phishing.","[""https://www.cisa.gov/sites/default/files/2023-11/aa23-xxx_stopransomware_rhysida.pdf""]",0.8,"Rhysida ransomware-as-a-service emerged around May 2023, targeting education, healthcare, manufacturing, IT, and government sectors via compromised VPN credentials and Zerologon exploitationhttps://www.cisa.gov/news-events/alerts/2023/11/15/cisa-fbi-and-ms-isac-release-advisory-rhysida-ransomware#:~:text=ransomware%20indicators%20of%20compromise%20,as%20recently%20as%20September%202023."
MAL-2023-12-01,Play,Ransomware,2022-06-01,ongoing,"[""CVE-2023-4966"", ""CVE-2024-57727"", ""CVE-2022-41080"", ""CVE-2022-41082""]","[""T1078"", ""T1566.002"", ""T1486""]","[""Valid Account Abuse"", ""Exploiting Fortinet and Exchange Vulnerabilities"", ""Double Extortion""]","{""encryption"": ""AES-256 with RSA-2048"", ""feature"": "".PLAY extension""}","[""Abuse of Valid Accounts"", ""Phishing"", ""Exploitation of VPN and RDP""]","[""Cobalt Strike"", ""SystemBC""]","[""Government"", ""Finance"", ""Manufacturing"", ""Healthcare""]",900.0,"[""US"", ""BR"", ""DE"", ""CH"", ""UK""]","{""victims"": 900}",,,,"[""Tor"", ""Darknet""]","[""CISA"", ""Trend Micro""]","Patch Fortinet and Exchange vulnerabilities, monitor remote management tools, implement strong passwords.","[""https://www.cisa.gov/sites/default/files/2025-06/aa25-xxx_stopransomware_play.pdf""]",0.8,"Play ransomware became one of the most active groups by mid-2025, affecting roughly 900 entities; it abuses valid accounts and exploits Fortinet and Microsoft Exchange vulnerabilities for initial accesshttps://www.cisa.gov/news-events/cybersecurity-advisories/aa23-352a#:~:text=Initial%20Accesshttps://www.cisa.gov/news-events/alerts/2025/06/04/updated-guidance-play-ransomware#:~:text=Read%20Full%20Advisory%20Text."
