# Scope: Major cybersecurity events in 2017, focusing on vulnerabilities, takedowns, and policy.
# Assumptions: Dates are based on public disclosure or event occurrence.
# Array Format: Lists (e.g., CVEs, malware) are semicolon-separated and enclosed in quotes.
event_id,date,event_type,title,description,affected_software_or_ecosystem,cve_ids,related_malware_families,potential_impact_on_malware,metrics,source_ids,confidence_score,notes
EVT-2017-03-07,2017-03-07,tool_release,WikiLeaks publishes 'Vault 7' (Year Zero),WikiLeaks began publishing 'Vault 7', a series of documents detailing CIA hacking tools and capabilities. This included exploits for iOS, Android, and smart TVs.,N/A,N/A,N/A,"Revealed numerous zero-day vulnerabilities and nation-state cyber capabilities, increasing awareness and risk.","{""notes"":""Revealed CIA hacking tools.""}",https://en.wikipedia.org/wiki/Vault_7,0.9,"This leak, along with the Shadow Brokers, highlighted the risk of nation-state tool proliferation."
EVT-2017-03-14,2017-03-14,patch_release,Microsoft releases MS17-010,Microsoft released security bulletin MS17-010, which patched multiple critical vulnerabilities in the Windows SMBv1 server. This patch was critical in stopping WannaCry, but many organizations failed to apply it.,Windows SMBv1,"CVE-2017-0144; CVE-2017-0145; CVE-2017-0146; CVE-2017-0147; CVE-2017-0148",WannaCry; NotPetya,"Provides the primary mitigation for the EternalBlue exploit, which fueled the largest ransomware outbreaks of the year.","{""cve_cvss_v3"":8.1,""vector"":""CVSS:3.0/AV:N/AC:H/PR:N/UI:N/S:U/C:H/I:H/A:H""}",https://docs.microsoft.com/en-us/security-updates/securitybulletins/2017/ms17-010,1.0,"This was the single most important patch of the year. Failure to apply it led directly to the WannaCry and NotPetya outbreaks."
EVT-2017-04-14,2017-04-14,tool_release,Shadow Brokers leak 'EternalBlue' exploit,The Shadow Brokers group leaked the 'EternalBlue' (MS17-010) and 'EternalRomance' exploits, alleged to be NSA tools. These exploits allowed for remote code execution over SMBv1.,Windows SMBv1,"CVE-2017-0144; CVE-2017-0145",WannaCry; NotPetya; Bad Rabbit,"Dramatically enables wormable malware, allowing ransomware to spread automatically and rapidly across networks without user interaction.","{""notes"":""Nation-state exploit leaked to public.""}",https://en.wikipedia.org/wiki/EternalBlue,1.0,"This event provided the weapon (EternalBlue) for the WannaCry and NotPetya attacks just weeks later."
EVT-2017-04-11,2017-04-11,new_cve,Microsoft Office RCE (CVE-2017-0199),A remote code execution vulnerability in Microsoft Office/WordPad was disclosed. It allowed code execution when a user opened a specially crafted document (e.g., RTF) containing an OLE object.,Microsoft Office; WordPad,"CVE-2017-0199",NotPetya,"Enables initial access via phishing documents. Was used as one of the infection vectors for NotPetya.",_x000D_
"{""cve_cvss_v3"":7.8,""exploit_available"":true}",https://nvd.nist.gov/vuln/detail/CVE-2017-0199,0.9,"This vulnerability was exploited by various malware, including as a secondary vector in the NotPetya attacks."
EVT-2017-05-12,2017-05-12,major_incident,WannaCry Outbreak,A massive global ransomware attack using the EternalBlue exploit (MS17-010) to spread as a worm. It crippled organizations worldwide, most notably the UK's National Health Service (NHS).,Windows,"CVE-2017-0144",WannaCry,"Demonstrated the catastrophic impact of combining ransomware with a wormable nation-state exploit.",_x000D_
"{""infections"":300000,""countries"":150}",https://www.cisa.gov/news-events/alerts/2017/05/12/alert-wannacry-ransomware,1.0,"The first major global wormable ransomware event."
EVT-2017-06-27,2017-06-27,major_incident,NotPetya Outbreak / Wiper Attack,A destructive wiper attack disguised as ransomware, primarily targeting Ukraine via a compromised update to M.E.Doc software. It used EternalBlue and other methods for lateral movement, causing over $10B in global damages.,Windows,"CVE-2017-0144; CVE-2017-0199",NotPetya,"Demonstrated the use of a supply-chain attack to deploy a wiper with devastating financial and operational impact.",_x000D_
"{""estimated_cost_usd"":10000000000}",https.www.cisa.gov/news-events/alerts/2017/07/01/petya-ransomware,1.0,"Widely considered the most financially damaging cyberattack in history."
EVT-2017-07-20,2017-07-20,law_enforcement_takedown,AlphaBay and Hansa Market Takedown,A coordinated international law enforcement operation seized and shut down two of the largest dark web marketplaces, AlphaBay and Hansa.,Dark Web Marketplaces,N/A,N/A,"Disrupts the ecosystem for selling malware, stolen data, and other cybercrime tools.",_x000D_
"{""notes"":""Major dark web market seizure.""}",https://www.justice.gov/opa/pr/alphabay-largest-online-dark-market-shut-down,0.9,"This operation disrupted a key hub for cybercriminal activity, including RaaS offerings."
EVT-2017-09-07,2017-09-07,major_incident,Equifax Data Breach Announced,Equifax announced a massive data breach affecting 147 million people. The breach occurred from May-July 2017 by exploiting a vulnerability in Apache Struts (CVE-2017-5638).,Apache Struts,"CVE-2017-5638",N/A,"Massive loss of sensitive PII (SSNs, birth dates), providing raw material for identity theft and sophisticated phishing for years to come.",_x000D_
"{""records_affected"":147000000}",https://www.ftc.gov/enforcement/cases-proceedings/refunds/equifax-data-breach-settlement,1.0,"One of the most significant PII breaches in history, caused by failure to patch a known vulnerability."
EVT-2017-03-07,2017-03-07,new_cve,Apache Struts RCE (CVE-2017-5638),A critical remote code execution vulnerability in Apache Struts 2 was disclosed. It was easy to exploit and allowed attackers to take full control of a web server.,Apache Struts 2,"CVE-2017-5638",N/A,"Enables initial access to unpatched web servers, leading to data breaches (Equifax) and potential malware deployment.",_x000D_
"{""cve_cvss_v3"":10.0,""exploit_available"":true}",https://nvd.nist.gov/vuln/detail/CVE-2017-5638,1.0,"The vulnerability responsible for the Equifax breach. It was patched, but Equifax failed to apply the patch."
EVT-2017-12-12,2017-12-12,new_cve,Huawei Router Vulnerability (CVE-2017-17215),A remote code execution vulnerability in Huawei HG532 routers was disclosed. It was quickly exploited by a variant of the Mirai botnet (Satori).,Huawei HG532,"CVE-2017-17215",Mirai (Satori),"Provides a new vector for IoT botnets to compromise routers and add them to their network.",_x000D_
"{""cve_cvss_v3"":8.8,""exploit_available"":true}",https://nvd.nist.gov/vuln/detail/CVE-2017-17215,0.9,"Showed the continued evolution of IoT botnets actively incorporating new exploits."